{
  "schema_version": "humanity-critic-output.v1",
  "review_id": "humanity_review_001",
  "content_type": "oracle_transition",
  "subject_id": "transition_002",
  "pass": true,
  "failed_rules": [],
  "strengths": [
    "固定日历时间与临时交付形成了具体但有状态依据的生活摩擦。",
    "三个选项分别采用协商、一次性调整和缩小范围，行动策略不同。",
    "选择改变的是时间配置和协作方式，没有保证关系或工作结果。"
  ],
  "revision_hint": null,
  "generated_at": "2026-07-31T09:46:00Z"
}
